{
  "schema_version": "1.0",
  "benchmark_id": "aider-polyglot",
  "task_id": "python/grade-school",
  "backend_id": "claude-code",
  "run_id": "run-001",
  "attempt": 1,
  "scores": {
    "tests_passed": true,
    "lint_passed": null,
    "typecheck_passed": null,
    "required_files_present": true,
    "timeout": false,
    "human_interventions": 0
  },
  "derived": {
    "elapsed_seconds": 30.6492,
    "files_changed": 7,
    "lines_added": 48,
    "lines_removed": 0,
    "failed_commands": 0
  },
  "result": "pass"
}